https://www.royallepage.ca/en/property/ontario/london/376-richmond-street/19927700/mls40439081/,"$1,950,000",,,0,,,,,,,,,,,44.79 Feet,"Downtown Area (DA1), D350, h-3",Sewer (Municipal),,,,,,,,,,,,,,,,,,,,,,,,< 0.5,,"Full, Finished",,Central Air,Street Parking Only,,Forced Air,"Board Room, Fireplace(s)",,"Urban, City Lot, High Traffic Area, Public Parking, Public Transit, Shopping Nearby, Visual Exposure",,,,,,,,Municipal,,,,,,,,,,,,,,,,,,,,,,,,,,,,,,,,,,,,,,,,,,,,,,,,,,,,,,,,,,,,,,,,,,,,,,,,,,,,,,,,,,,,,,,,,
https://www.royallepage.ca/en/property/ontario/london/1890-fountain-grass-drive/19920487/mls40438811/,"$1,089,000",,,5,3+1,,,,,,,2314 Square Feet,,106 Feet,40.00 Feet,R1-4,Sewer (Municipal),,,Main Level,"Other level
                
            
        
        
            
                :Lower3.15 X 4.04",2nd Level3.61 X 4.88,"Other level
                
            
        
        
            
                :Lower3.89 X 6.38",,Main Level3.35 X 4.57,,,,,,,,,,2nd Level2.31 X 1.57,,,Main Level3.35 X 1.83,Main Level5.79 X 4.57,,< 0.5,Two Story,"Full, Finished","Stone, Stucco, Vinyl Siding",Central Air,Private Drive Double Wide,,Forced Air,Other,Upper Level,"Urban, Near Golf Course, Park, Place of Worship, Playground Nearby, School Bus Route, Schools, Shopping Nearby, Skiing, Trails",,Attached Garage,,Asphalt Shing,"Carbon Monoxide Detector, Smoke Detector","Cable Available, Cell Service, Electricity Available, Garbage/Sanitary Collection, High Speed Internet Avail, Recycling Pickup, Street Lights, Phone Available",,Municipal-Metered,,,,,,,,,,,,Main Level2.13 X 3.66,2nd Level,,,,,,,,,,,,,,,,,,Main Level3.35 X 3.05,,,,,,,,,,,,,,,,,,,,,,,,,,,,,,,,,,,,,,,,,,,,,,,,,,,,,,,,,,
https://www.royallepage.ca/en/property/ontario/london/2600-buroak-dr/19908387/mlsx6149240/,"$1,079,000",Freehold,Single Family,4,4,,,,,,,,,,,,,Attached garage,6,,Upper Level4.80 m x 3.76 m15.75 ft x 12.34 ft,Upper Level5.18 m x 3.86 m16.99 ft x 12.66 ft,,Main Level3.66 m x 2.46 m12.01 ft x 8.07 ft,Main Level5.66 m x 3.66 m18.57 ft x 12.01 ft,,Main Level5.44 m x 4.52 m17.85 ft x 14.83 ft,,,,,,,,,,,,,,,,,,,,,,,,,,,,,,,,,,,Yes,40.03 x 111.55 FT,,,,,,,,,,,,,,,,,,,,,,,,,,,,,,,,,,,,,,,,,,,,,,,,,,,,,,,,,,,,,,,,,,,,,,,,,,,,,,,,,,,,,
https://www.royallepage.ca/en/property/ontario/london/1370-bush-hill-link/19928349/mls40438470/,"$894,900",,,4,2+1,,,,,,,1904 Square Feet,,118 Feet,33.00 Feet,R1-3,Sewer (Municipal),,4,Main Level,2nd Level3.38 X 3.05,2nd Level3.35 X 3.96,,,Main Level3.71 X 3.25,,,,,,,,,,2nd Level1.47 X 1.52,,,,Main Level4.27 X 5.18,,< 0.5,Two Story,"Development Potential, Full, Finished, Sump Pump","Brick, Vinyl Siding",Central Air,Private Drive Double Wide,,"Forced Air, Natural Gas",Rough-in Bath,"Laundry Room, Upper Level","Urban, Irregular Lot, Park, Playground Nearby, Public Transit, Schools, Shopping Nearby, Trails",None,"Attached Garage, Paver Block",Municipal Road,Shingle,None,"Cable Available, Electricity Available, Garbage/Sanitary Collection, High Speed Internet Avail, Natural Gas Available, Recycling Pickup, Phone Available",,Municipal,,,,,,,,,,,,,2nd Level,,,,,,,,,,,,,,,,,None,Main Level3.66 X 3.05,,,,,,,,,,,,,,,,,,,,,,,,,,,,,,,,,,,,,,,,,,,,,,,,,,,,,,,,,,
https://www.royallepage.ca/en/property/ontario/london/46-1781-henrica-avenue/19916630/mls40437948/,"$679,900",,,4,3+1,,,,2023,,,1873 Square Feet,,40 Feet,19.40 Feet,"R5-6, R6-5",Sewer (Municipal),,,Main Level,2nd Level3.53 X 2.90,3rd Level4.14 X 4.57,,2nd Level2.77 X 3.30,2nd Level2.87 X 3.30,,2nd Level4.70 X 6.58,,,,,,,,,,,,,,< 0.5,Two Story,"Other, None","Brick, Vinyl Siding",Central Air,Private Drive Double Wide,"Privacy, Year Round Living","Combo Furnace, Forced Air",High Speed Internet,"In-Suite, Inside, Washer Hookup","Urban, Rectangular, High Traffic Area, Park, Place of Worship, Playground Nearby, Public Transit, Rec./Community Centre, School Bus Route, Schools, Shopping Nearby, Trails",None,"Attached Garage, Assigned",Municipal Road,Shingle,None,"At Lot Line-Gas, At Lot Line-Hydro, At Lot Line-Municipal Water, Cable Connected, Electricity Available, Garbage/Sanitary Collection, Natural Gas Available, Recycling Pickup, Street Lights, Phone Connected","City, Clear, Trees/Woods",Municipal,None,River/Stream,,,,,,,,,,,,,,,,,,,,,,,,,,,BBQs Permitted,None,,None,,,,,,,,,,,,,,,,,,,,,,,,,,,,,,,,,,,,,,,,,,,,,,,,,,,,,,,,,
https://www.royallepage.ca/en/property/ontario/london/131-high-street/19915776/mls40432892/,"$624,900",,,5,2+0,,,,,,,2329 Square Feet,,196 Feet,39.00 Feet,R2-2,Sewer (Municipal),,,Main Level2.44 X 2.41,Main Level3.96 X 3.00,Main Level4.09 X 3.66,,,,,Main Level6.25 X 3.86,,,,,Main Level4.42 X 2.36,Main Level3.35 X 1.75,,Main Level3.58 X 1.96,,,,,,< 0.5,1.5 Storey,"Partial, Unfinished","Brick, Stucco, Wood Siding",Central Air,"Front Yard Parking, Private Drive Single Wide",Separate Hydro Meters,"Baseboard, Electric, Forced Air, Natural Gas","Ceiling Fan(s), In-law Capability, Separate Hydro Meters","Main Level, Multiple Locations, Washer Hookup","Urban, Arts Centre, Business Centre, City Lot, Hospital, Library, Park, Place of Worship, Playground Nearby, Public Transit, Rec./Community Centre, Schools, Shopping Nearby, Trails",Shed(s),Circular,,Asphalt Shing,Smoke Detector(s),,,Municipal,,River/Stream,,,,,,,,,,,Main Level6.40 X 3.66Note:Kitchen/Dining Room,,Fence - Partial,"Window Coverings, Skylight(s)",,,,,,,,,,,Basement Level8.53 X 6.10,,,,,,,,,,,,,,Main Level3.86 X 2.34,,,,,,,,,,,,,,,,,,,,,,,,,,,,,,,,,,,,,,,,,,,,,,,,
https://www.royallepage.ca/en/property/ontario/london/34-40-fairfax-court/19927609/mls40439087/,"$459,900",,,3,2+0,,,,1977,,,1344 Square Feet,,,,R5-3,Sewer (Municipal),,,3rd Level,3rd Level3.66 X 3.05,3rd Level4.75 X 3.00,,2nd Level3.91 X 3.00,2nd Level4.01 X 3.02,"Other level
                
            
        
        
            
                :Lower6.02 X 2.97",2nd Level5.13 X 4.06,,,,,,,,,,,,,,Not Applicable,3 Storey,"Walk-Out Access, Full, Finished","Brick, Vinyl Siding",None,Private Drive Single Wide,,"Forced Air, Natural Gas",,In-Suite,"Urban, Library, Place of Worship, Playground Nearby, Rec./Community Centre, Regional Mall, Schools, Shopping Nearby",None,"Attached Garage, Exclusive",Municipal Road,Asphalt Shing,Smoke Detector(s),"Electricity Connected, Garbage/Sanitary Collection, Natural Gas Connected, Recycling Pickup",City,Municipal-Metered,,,,,,,,,,,,,,,,,,,,,,,,,,,,,"BBQs Permitted, Parking",None,,,,,,,,,,,,,,,,,,,,,,,,,,,,,,,,,,,,,,,,,,,,,,,,,,,,,,,,,,,
https://www.royallepage.ca/en/property/ontario/london/452-hamilton-road/19924139/mls40438831/,"$179,900",,,0,,,,,,,,,,74.57 Feet,32.89 Feet,BDC(36) - H13,Sewer (Municipal),,,,,,,,,,,,,,,,,,,,,,,,,,"Partial, Unfinished",,None,,,"Forced Air, Natural Gas",,,"Business Centre, High Traffic Area, Library, Public Transit, Schools, Shopping Nearby",,,,,,,,Municipal,,,,,,,,,,,,,,,,,,,,,,,,,,,,,,,,,,,,,,,,,,,,,,,,,,,,,,,,,,,,,,,,,,,,,,,,,,,,,,,,,,,,,,,,,
https://www.royallepage.ca/en/property/ontario/london/536-queens-avenue/19907045/mls40437242/,"$1,500,000",,,0,,,,,,,,,,158.15 Feet,87.50 Feet,"R3-1, OC5",Sewer (Municipal),,15,,,,,,,,,,,,,,,,,,,,,,< 0.5,,"Partial, Unfinished",Brick,Ductless,Outside/Surface/Open,,"Forced Air, Natural Gas, Hot Water-Other, Radiant",,,"Urban, Irregular Lot, Ample Parking, Corner Lot, City Lot, High Traffic Area, Landscaped, Library, Major Anchor, Open Spaces, Park, Place of Worship, Playground Nearby, Public Parking, Public Transit, Shopping Nearby",,,Municipal Road,,,,,Municipal-Metered,,,,,,,,,,,,,,,,,,,,,,,,,,,,,,,,,,,,,,,,,,,,,,,,,,,,,,,,,,,,,,,,,,,,,,,,,,,,,,,,,,,,,,,,,
https://www.royallepage.ca/en/property/ontario/london/796-dundas-street/19911066/mls40429487/,"$799,900",,,0,,,,,,,,,,203.92 Feet,33.00 Feet,BDC(19)*D250*H46,Sewer (Municipal),,8,,,,,,,,,,,,,,,,,,,,,,,,"Development Potential, Separate Entrance, Walk-Up Access, Full, Partially Finished","Brick Veneer, Block, Other","Central Air, Other",Private Drive Single Wide,,"Forced Air, Natural Gas",,,"City Lot, High Traffic Area, Hospital, Shopping Nearby",,Exclusive,,,Smoke Detector(s),"At Lot Line-Gas, At Lot Line-Hydro, Electricity Available, Garbage/Sanitary Collection, High Speed Internet Avail, Recycling Pickup, Street Lights",Downtown,Municipal,,,,,,,,,,,,,,,,,,,,,,,,,,,,,,None,,,,,,,,,,,,,,,,,,,,,,,,,,,,,,,,,,,,,,,,,,,,,,,,,,,,,,,,,,,
https://www.royallepage.ca/en/property/ontario/london/3862-auckland-ave/19905354/mlsx6146488/,"$799,000",Freehold,Single Family,4,3,,,,,,,,,,,,,Attached garage,3,,,,,Main LevelMeasurements not available,Main LevelMeasurements not available,,,,,,,,,,Basement LevelMeasurements not available,,,Main LevelMeasurements not available,Main LevelMeasurements not available,,,,,,,,,,,,,,,,,,,,,,,Yes,32.89 x 108 FT,2nd LevelMeasurements not available,2nd LevelMeasurements not available,,,,,,,,,,,,,,,,,,,,,,,,,,,,,,,,,,,,,,,,,,,,,,,,,,,,,,,,,,,,,,,,,,,,,,,,,,,,,,,,,,,
https://www.royallepage.ca/en/property/ontario/london/1068-margaret-street/19911076/mls40437546/,"$379,900",,,2,1+0,,,,1914,,,870.63 Square Feet,,132 Feet,32.00 Feet,R2-2,Sewer (Municipal),,,Main Level2.13 X 2.74,Main Level2.92 X 3.07,,,Main Level3.40 X 3.38,Main Level5.46 X 2.84,,Main Level4.83 X 3.20,,,,,,Main Level1.55 X 3.20,Basement Level6.30 X 6.43,,,,,,,< 0.5,Bungalow,"Partial, Unfinished",Vinyl Siding,None,Private Drive Single Wide,,"Forced Air, Natural Gas","High Speed Internet, Ceiling Fan(s)",In Basement,"Urban, City Lot, Hospital, Place of Worship, Public Transit, School Bus Route, Shopping Nearby",Shed(s),Asphalt,Municipal Road,Shingle,,"Cell Service, Electricity Connected, Garbage/Sanitary Collection, Natural Gas Connected, Recycling Pickup, Street Lights, Phone Connected",,Municipal,,,,,,,,,,,,Main Level2.87 X 2.95,,,Full,,,,,,,,,,,Paved,Basement Level6.30 X 3.30,,,,,,,,,,,,,,,,,,,,,,,,,,,,,,,,,,,,,,,,,,,,,,,,,,,,,,,,,,,,,,
https://www.royallepage.ca/en/property/ontario/london/1117-the-parkway/19906037/mls40436648/,"$2,190,000",,,5,4+1,,,,1953,,,3834 Square Feet,,,75.00 Feet,R1-9,Sewer (Municipal),,,2nd Level,2nd Level5.16 X 5.44,Main Level5.16 X 5.44,,Main Level3.99 X 4.57,Main Level5.64 X 5.16,"Other level
                
            
        
        
            
                :Lower5.26 X 5.03",Main Level7.01 X 4.27,,,,,Main Level4.11 X 4.52,,,,,,,,,< 0.5,Two Story,"Full, Finished",Brick,Central Air,Private Drive Double Wide,"Landscaped, Lawn Sprinkler System, Privacy","Forced Air, Natural Gas, Radiant Floor","Central Vacuum, Built-In Appliances","In Kitchen, Main Level","Urban, Irregular Lot, City Lot, Landscaped, Schools, Shopping Nearby, Trails",Shed(s),"Attached Garage, Garage Door Opener",,Shake,Security System,,River,Municipal,,"River, River Front, River/Stream",,,,,,,,Wood Burning,,Main Level2.29 X 3.91,Main Level,,Full,Window Coverings,,,,,,,,,,,,,,,,,,,,,,,,,,"Other level
                
            
        
        
            
                :Lower5.28 X 5.89",,,,,,,,,,,None,,,,,,,,,,,,,,,,,,,,,,,,,,,,,,,,,,,,
https://www.royallepage.ca/en/property/ontario/london/2025-ashgrove-court/19899408/mls40434235/,"$1,999,999",,,6,4+1,,,,,,,2725 Square Feet,,238.22 Feet,148.00 Feet,R1-14,Septic Tank,,12,Main Level,Main Level3.66 X 3.66,Main Level4.57 X 5.11,Basement Level12.50 X 7.32,Main Level3.48 X 4.57,Main Level3.78 X 7.62,Main Level4.70 X 5.94,Main Level3.48 X 4.57,,,,,,,Basement Level3.53 X 5.79,Basement Level2.74 X 2.44,,,,,,,Bungalow,"Walk-Out Access, Full, Finished, Sump Pump","Brick, Brick Front",Central Air,Private Drive Triple+ Wide,,"Electric, Fireplace-Gas, Forced Air","Built-In Appliances, Ceiling Fan(s), Central Vacuum Roughed-in, In-Law Floorplan, Water Treatment","In Building, In-Suite, Laundry Closet, Laundry Room, Lower Level, Washer Hookup","Urban, Cul-De-Sac, Near Golf Course, Park, Public Transit, Quiet Area, Ravine, School Bus Route, Schools, Shopping Nearby, Trails",,"Attached Garage, Garage Door Opener, Paver Block",,Asphalt Shing,"Carbon Monoxide Detector, Smoke Detector",,,Drilled Well,,River/Stream,,,,,,,,Gas,,,Main Level3.05 X 2.87,,,,,,,,,,,,,,,,,,,,,,,,,,,,,,,,,,,,,,,,,,,,,,,,,,,,,,,,,,,,,,,,,,,,,,,,,,,,
https://www.royallepage.ca/en/property/ontario/london/461-sophia-cres/19894986/mlsx6140464/,"$1,349,999",Freehold,Single Family,5+2,5,,,,,,,,,,,,,Attached garage,4,Basement LevelMeasurements not available,Basement LevelMeasurements not available,2nd LevelMeasurements not available,,Main LevelMeasurements not available,Main LevelMeasurements not available,Main LevelMeasurements not available,,,,,,,,,,,,,,,,,,,,,,,,,,,,,,,,,,,,Yes,40.03 x 109.91 FT,2nd LevelMeasurements not available,2nd LevelMeasurements not available,,,,,,,,,,,,,,,,,,,,,,,,,,,2nd LevelMeasurements not available,,,,,,,,,,,,,,,,,,,,,,,,,,,,,,,,,,,,,,,,,,,,,,,,,,,,,,,,
https://www.royallepage.ca/en/property/ontario/london/1209-30-chapman-court/19899475/mls40436555/,"$429,900",,,2,2+0,,,,1995,,,900 Square Feet,,,0.00 Feet,R9-7;H38,Sewer (Municipal),,1,Main Level,Main Level4.11 X 3.35,Main Level4.11 X 3.20,,Main Level3.66 X 3.05,Main Level2.44 X 2.44,,Main Level7.32 X 3.05,,,,,,,,,,,,,,,1 Storey/Apt,None,Brick,Central Air,Covered Parking,,"Forced Air, Natural Gas",,In-Suite,"Urban, Hospital, Major Anchor, Place of Worship, Public Parking, Public Transit, School Bus Route, Schools, Shopping Nearby",None,Exclusive,,Other,Smoke Detector(s),None,,Municipal-Metered,None,,,,,,$405,,,,,,,,,,,,,,,,,,,,,,"Elevator(s), Fitness Center",None,,None,,,,,,,,,,,,,,,,,,,,,,,,,,,,,,,,,,,,,,,,,,,,,,,,,,,,,,,,,
https://www.royallepage.ca/en/property/ontario/london/2189-dundas-streetunit-84/19889993/mlsh4166075/,"$185,000",Freehold,Single Family,1,1,,,,1975,,Crushed stone driveway,502.00 Square Feet,,50.0 Feet,12.0 Feet,,Municipal sewage system,"Gravel, No Garage",2,Ground LevelMeasurements not available,Ground Level11' 2'' x 8' 10'',,,,Ground Level11' '' x 10' '',,Ground Level11' 2'' x 11' 7'',,,,,Ground Level24' 4'' x 47' 2'',,,Ground LevelMeasurements not available,,,,,,,,,,,,,,,,,,,,,,,,,,,Yes,12 x 50,,,,,,,,Ground Level4' 9'' x 4' 9'',,,,,,,,,,,,,,,,,,,,,,,,,,,,,,,,,,,,,,,,,,,,,,,,,,,,,,,,,,,,,,,,,,,,,,,,,,,,,
https://www.royallepage.ca/en/property/ontario/london/84-2189-dundas-st/19889824/mlsx6137340/,"$185,000",,Single Family,1,1,,,,,,,,,,,,,,2,Main LevelMeasurements not available,Main Level3.40 m x 2.46 m11.15 ft x 8.07 ft,,,,Main Level3.35 m x 3.05 m10.99 ft x 10.01 ft,,Main Level3.40 m x 3.53 m11.15 ft x 11.58 ft,,,,,Main Level7.50 m x 14.40 m24.61 ft x 47.24 ft,,,Main LevelMeasurements not available,,,,,,,,,,,,,,,,,,,,,,,,,,,Yes,12 x 50 FT,,,,,,,,Main Level1.50 m x 1.50 m4.92 ft x 4.92 ft,,,,,,,,,,,,,,,,,,,,,,,,,,,,,,,,,,,,,,,,,,,,,,,,,,,,,,,,,,,,,,,,,,,,,,,,,,,,,
https://www.royallepage.ca/en/property/ontario/london/1717-upper-west-avenue/19893342/mls40436095/,"$1,999,999",,,6,4+1,,,,2021,,,3654 Square Feet,,113.12 Feet,60.01 Feet,R1-5,Sewer (Municipal),,,2nd Level,"Other level
                
            
        
        
            
                :Lower2.87 X 3.73",2nd Level8.05 X 6.25,,,,"Other level
                
            
        
        
            
                :Lower5.66 X 5.33",Main Level5.46 X 5.49,,,,,,Main Level2.41 X 3.96,,2nd Level3.15 X 3.12,,,,,,< 0.5,Two Story,"Walk-Out Access, Full, Finished",Brick Veneer,"Central Air, Energy Efficient, Humidity Control",Private Drive Double Wide,,"Fireplace-Gas, Forced Air","Central Vacuum, Auto Garage Door Remote(s), Built-In Appliances",,"Urban, Landscaped, Open Spaces, Park, Place of Worship, Playground Nearby, School Bus Route, Schools, Shopping Nearby",,"Attached Garage, Garage Door Opener",Municipal Road,Asphalt Shing,Carbon Monoxide Detector,,,Municipal-Metered,,,,,,,,,,Family Room,Main Level3.12 X 3.86,,2nd Level,,,,,,,,,,,,,,,Main Level6.76 X 6.38,,,Main Level3.53 X 4.55,,,,,,,,,,,,,,,,,,,,,,,,,,,,,,,,,,,,,,,,,,,,,,,,,,,,,,,,,,
https://www.royallepage.ca/en/property/ontario/london/lot-30-silver-creek-circle/19889114/mls40436048/,"$1,689,900",,,4,2+2,,,,2023,,,3516 Square Feet,,121.66 Feet,53.34 Feet,R1-8(5) & R1-8(8),Sewer (Municipal),,,Main Level,2nd Level4.50 X 3.81,2nd Level5.33 X 4.98,,Main Level5.94 X 3.45,Main Level3.51 X 4.27,,,,,,,,,,2nd Level,,,Main Level,Main Level5.99 X 4.52,,< 0.5,Two Story,"Development Potential, Full, Finished","Brick, Stone, Stucco, Vinyl Siding",Central Air,Private Drive Double Wide,,Forced Air,"High Speed Internet, Built-In Appliances",Upper Level,"Urban, Rectangular, Cul-De-Sac, Near Golf Course, Library, Open Spaces, Park, Playground Nearby, Quiet Area, Schools",None,"Attached Garage, Garage Door Opener, Exclusive",Municipal Road,Asphalt Shing,Smoke Detector,"At Lot Line-Gas, At Lot Line-Hydro, At Lot Line-Municipal Water, Cell Service, Electricity Connected, Phone Connected",City,Municipal,,,,,,,,,,Gas,,,"Other level
                
            
        
        
            
                :LowerNote:Basement",,,,,,,,,,,,,,,,,,,,,,,,,,,,,,,,,,,,,,,,,Main Level3.71 X 4.55,,,,,,,,,,,,,,,,,,,,,,,,,,,,,,,,,,,
https://www.royallepage.ca/en/property/ontario/london/1485-thornley-st/19888206/mlsx6134592/,"$1,399,990",Freehold,Single Family,4,3,,,Schools,,School Bus,,,,,,,,Attached garage,6,Main LevelMeasurements not available,,2nd LevelMeasurements not available,,Main LevelMeasurements not available,Main LevelMeasurements not available,Main LevelMeasurements not available,Main LevelMeasurements not available,,,,"Cable - Available, Hydro - Available, Sewer - Available, Natural Gas - Available",,Main LevelMeasurements not available,,Main LevelMeasurements not available,,,,,,,,,,,,,,,,,,,,,,,,,,,Yes,77 x 115 FT,2nd LevelMeasurements not available,2nd LevelMeasurements not available,,,,,Main LevelMeasurements not available,,,,,,,,,,,,,,,,,,,,,,2nd LevelMeasurements not available,,,,,,,,,,,,,,,,,,,,,,,,,,,,,,,,,,,,,,,,,,,,,,,,,,,,,,,,
https://www.royallepage.ca/en/property/ontario/london/806-363-colborne-street/19893290/mls40436225/,"$378,300",,,2,2+0,,,,1986,,,1036 Square Feet,,,0.00 Feet,DA2,Sewer (Municipal),,,Main Level,Main Level3.63 X 3.10,Main Level4.78 X 3.07,,Main Level4.55 X 2.29,Main Level7.16 X 4.06,,Main Level7.16 X 4.06,,,,,,,,,,,,,,< 0.5,1 Storey/Apt,,Concrete,Central Air,"Covered Parking, Visitor Parking","Balcony, Controlled Entry, Tennis Court(s)","Electric Forced Air, Heat Pump","Auto Garage Door Remote(s), Built-In Appliances",In-Suite,"Urban, Arts Centre, Business Centre, Dog Park, City Lot, Hospital, Library, Park, Place of Worship, Playground Nearby, Public Parking, Schools, Shopping Nearby",,Garage Door Opener,"Municipal Road, Public Road","Flat, Tar/Gravel","Carbon Monoxide Detector, Smoke Detector, Carbon Monoxide Detector(s), Smoke Detector(s)",,City,Municipal,,,,,,,$601,,,"Electric, Family Room",,,,,,Window Coverings,,,,,,,,,,Paved,,,"Elevator(s), Fitness Center, Guest Suites, Library, Pool, Sauna, Tennis Court(s), Parking","Indoor, Salt Water, Indoor, Salt Water",,,,,,,,,,,,,,,,,,,,,,,,,,,,,,,,,,,,,,,,,,,,,,,,,,,,,,,,,,,
https://www.royallepage.ca/en/property/ontario/london/244-dundas-street/19889073/mls40435975/,"$174,999",,,,,,,,,,,,,,,,,,,,,,,,,,,,,,,,,,,,,,,,,,,,,,,,,,"City Lot, High Traffic Area, Place of Worship, Public Parking, Public Transit, Schools, Shopping Nearby, Visual Exposure",,,,,,,,,,,,,,,,,,,,,,,,,,,,,,,,,,,,,,,,,,,,,,,,,,,,,,,,,,,,,,,Food & Beverage,,,,,,,,,,,,,,,,,,,,,,,,,,,,,,,,,,
https://www.royallepage.ca/en/property/ontario/london/3447-silverleaf-chase/19886575/mls40433487/,"$1,998,000",,,6,5+1,,,,2021,,,3067 Square Feet,,121.54 Feet,64.99 Feet,R1-8(5) R1-8(8),Sewer (Municipal),,,2nd Level,2nd Level3.78 X 3.63,2nd Level5.66 X 4.88,,Main Level5.49 X 3.25,Main Level5.49 X 3.48,"Other level
                
            
        
        
            
                :Lower5.16 X 9.35",,,,,,,Main Level5.72 X 2.01,,2nd Level2.62 X 3.17,,Main Level3.63 X 1.50,Main Level2.67 X 2.06,,,< 0.5,Two Story,"Separate Entrance, Walk-Up Access, Full, Finished, Sump Pump","Brick, Stucco, Vinyl Siding","Central Air, Energy Efficient",Private Drive Triple+ Wide,"Landscape Lighting, Landscaped","Forced Air, Natural Gas","High Speed Internet, Central Vacuum, Air Exchanger, Auto Garage Door Remote(s), Built-In Appliances, In-law Capability","Inside, Upper Level","Urban, Irregular Lot, Highway Access, Hospital, Landscaped, Library, Park, Place of Worship, Playground Nearby, Public Transit, Rec./Community Centre, School Bus Route, Schools, Shopping Nearby, Skiing",Gazebo,"Attached Garage, Garage Door Opener, Concrete",Public Road,Shingle,"Carbon Monoxide Detector, Smoke Detector, Carbon Monoxide Detector(s), Smoke Detector(s)","Cable Connected, Cell Service, Electricity Connected, Fibre Optics, Garbage/Sanitary Collection, Natural Gas Connected, Recycling Pickup, Street Lights, Phone Connected",Pool,Municipal-Metered,,River/Stream,,,,,,,,Electric,Main Level3.84 X 3.02,,2nd Level,,Full,Window Coverings,,,,,,,,,,Paved,,,,"In Ground, Salt Water, In Ground, Salt Water",,,,,,,,,,,,,,,,,,,,,,,,,,,,,,,,,,,,,,,,,,,,,,,,,,,,,,,,,,,
https://www.royallepage.ca/en/property/ontario/london/2-2810-sheffield-pl/19879984/mlsx6127700/,"$999,900",Condominium/Strata,Single Family,5,3,,,,,,"Cul-de-sac, Conservation/green belt",,,,,,,"Attached garage, Visitor parking",4,Main LevelMeasurements not available,Main Level3.33 m x 2.84 m10.93 ft x 9.32 ft,2nd Level5.08 m x 4.88 m16.67 ft x 16.01 ft,,Main Level3.63 m x 3.94 m11.91 ft x 12.93 ft,Main Level5.00 m x 4.27 m16.40 ft x 14.01 ft,,Main Level4.27 m x 3.94 m14.01 ft x 12.93 ft,,,,,,,,,,,Main Level3.30 m x 3.02 m10.83 ft x 9.91 ft,,,,,,,,,,,,,,,,,,,,,,,,,,,2nd Level4.34 m x 3.63 m14.24 ft x 11.91 ft,$190 Monthly,,,,,,,,,,,,,,,,,,,,,,,,,,2nd Level3.02 m x 3.48 m9.91 ft x 11.42 ft,,,,,,,,,,,,2nd Level4.37 m x 3.00 m14.34 ft x 9.84 ft,,,,,,,,,,,,,,,,,,,,,,,,,,,,,,,,,,,,,,,,,,,View,
https://www.royallepage.ca/en/property/ontario/london/201-clarence-st/19879095/mlsx6128172/,"$559,999",,Single Family,2+1,2,,,"Hospital, Park, Public Transit, Schools",,School Bus,,,,,,,,,2,,Main LevelMeasurements not available,,,,Main LevelMeasurements not available,,Main LevelMeasurements not available,,,,,,,,Main LevelMeasurements not available,,,,,,,,,,,,,,,,,,,,,,,,,,,Yes,29.99 x 62 FT,2nd LevelMeasurements not available,,,,,,,,,,,,,,,,,,,,,,,,,,,,,,,,,,,,,,,,,,,,,,,,,,,,,,,,,,,,,,,,,,,,,,,,,,,,,,,,,,,,
https://www.royallepage.ca/en/property/ontario/london/1781-oxford-street-e/19889467/mls40436071/,$1,,,0,,,,,,,,,,,119.00 Feet,"RSC 1,4,5",Shared,,,,,,,,,,,,,,,,,,,,,,,,5-9.99,,None,,Other,Outside/Surface/Open,,Other,,,"Urban, Irregular Lot, High Traffic Area",,,Public Road,,,,,Municipal-Metered,,,,,,,,,,,,,,,,,,,,,,,,,,,,,,,,,,,,,,,,,,,,,,,,,,,,,,,,,,,,,,,,,,,,,,,,,,,,,,,,,,,,,,,,,
https://www.royallepage.ca/en/property/ontario/london/3-349-southdale-road-e/19877841/mls40435362/,"$695,000",,,3,2+1,,,,2023,,,1629 Square Feet,,80 Feet,22.00 Feet,R6-5,Sewer (Municipal),,,3rd Level,3rd Level3.23 X 3.05,3rd Level4.19 X 3.78,Main Level3.20 X 3.25,2nd Level4.11 X 3.38,2nd Level4.37 X 3.07,,2nd Level3.78 X 4.42,,,,,,,,3rd Level1.22 X 1.07,,,,,,Not Applicable,3 Storey,"Other, None","Brick, Vinyl Siding",Central Air,"Private Drive Single Wide, Visitor Parking","Balcony, Controlled Entry","Forced Air, Natural Gas",Separate Hydro Meters,Upper Level,"Urban, Business Centre, Near Golf Course, Greenbelt, High Traffic Area, Highway Access, Park, Place of Worship, Playground Nearby, Public Transit, Rec./Community Centre, Regional Mall, School Bus Route, Schools, Shopping Nearby",None,"Attached Garage, Exclusive, Inside Entry, Assigned","Fees Apply, Municipal Road, Private Road, Public Road",Shingle,"Carbon Monoxide Detector, Smoke Detector, Carbon Monoxide Detector(s), Smoke Detector(s)","Cell Service, Electricity Connected, Garbage/Sanitary Collection, Natural Gas Connected, Recycling Pickup, Street Lights, Phone Available",City,Municipal-Metered,,,,,,,,,,,,,,,,,,,,,,,,,,Paved,,,"BBQs Permitted, Parking",None,,,,,,,,,,,,,,,,,,,,,,,,,,,,,,,,,,,,,,,,,,,,,,,,,,,,,,,,,,,
https://www.royallepage.ca/en/property/ontario/london/112-ardsley-crescent/19877848/mls40434941/,"$619,900",,,3,1+1,,,,1983,,,903 Square Feet,,100.32 Feet,40.14 Feet,R1-4,Sewer (Municipal),,,Main Level,"Other level
                
            
        
        
            
                :Lower4.60 X 3.33",Main Level3.89 X 3.51,"Other level
                
            
        
        
            
                :Lower7.29 X 3.96",Main Level3.56 X 2.44,Main Level3.63 X 2.82,,Main Level4.95 X 3.43,,,,,,Main Level1.93 X 1.22,,"Other level
                
            
        
        
            
                :Lower3.76 X 2.77",,,,,,< 0.5,Bungalow Raised,"Separate Entrance, Full, Finished","Brick, Vinyl Siding",Central Air,Private Drive Single Wide,,"Forced Air, Natural Gas","High Speed Internet, None",In Basement,"Urban, Park, Place of Worship, Playground Nearby, Public Transit, Quiet Area, Rec./Community Centre, School Bus Route, Schools",Shed(s),,,Asphalt Shing,None,"Garbage/Sanitary Collection, Street Lights, Underground Utilities",Trees/Woods,Municipal-Metered,,,,,,,,,,Wood Burning,,,,,,,,,,,,,,,,,,,,,,,,,,,,,,,,,,,,,,,,,,,,,,,,,,,,,,,,,,,,,,,,,,,,,,,,,,,,,,,
