https://www.royallepage.ca/en/property/ontario/london/38-julie-crescent/20229731/mls40461845/,"$773,900",,,3,2+1,,,,,,,1641 Square Feet,,98 Feet,36.00 Feet,R1-1,Sewer (Municipal),,,Main Level,2nd Level3.05 X 4.19,2nd Level4.60 X 4.65,,Main Level2.84 X 3.35,Main Level2.84 X 0.61,,Main Level3.35 X 4.62,,,,,,,,2nd Level,,,,,,< 0.5,Two Story,"Walk-Out Access, Full, Unfinished",Other,Central Air,Private Drive Single Wide,,Forced Air,,Laundry Room,"Urban, Highway Access, Hospital, Open Spaces, Public Transit, Quiet Area, Schools, Shopping Nearby, Trails",,"Attached Garage, Garage Door Opener, Exclusive, Interlock",,Shingle,,,,Municipal,,River/Stream,,,,,,,,,,,2nd Level,,,,,,,,,,,,,,,,,,,,,,,,,,,,,,,,,,,,,,,,,,,,,,,,,,,,,,,,,,,,,,,,,,,,,,,,,,,,
https://www.royallepage.ca/en/property/ontario/london/971-deveron-crescent/20229630/mls40461983/,"$755,900",,,3,2+1,,,,,,,1618 Square Feet,,108 Feet,32.00 Feet,R1-1,Sewer (Municipal),,,2nd Level,2nd Level3.20 X 4.06,2nd Level3.61 X 4.83,,2nd Level2.69 X 3.58,Main Level3.81 X 2.84,,Main Level3.63 X 5.49,,,,,,,,2nd Level,,,,,,< 0.5,Backsplit,"Other, Full, Unfinished",Other,Central Air,Private Drive Single Wide,,Forced Air,,Laundry Room,"Urban, Highway Access, Hospital, Open Spaces, Public Transit, Quiet Area, Schools, Shopping Nearby, Trails",,"Attached Garage, Garage Door Opener, Exclusive, Interlock",,Shingle,,,,Municipal,,River/Stream,,,,,,,,,,,2nd Level,,,,,,,,,,,,,,,,,,,,,,,,,,,,,,,,,,,,,,,,,,,,,,,,,,,,,,,,,,,,,,,,,,,,,,,,,,,,
https://www.royallepage.ca/en/property/ontario/london/59-wentworth-ct-court/20222938/mls40461529/,"$649,900",,,3,1+1,,,,1973,,,1582 Square Feet,,120.3 Feet,54.90 Feet,R1-8,Sewer (Municipal),,,Main Level,2nd Level3.38 X 3.94,2nd Level3.38 X 5.13,,Main Level2.77 X 3.68,Main Level2.77 X 3.68,Main Level6.15 X 3.68,Main Level5.84 X 4.04,,,,,,,,"Other level
                
            
        
        
            
                :Lower2.24 X 2.06",,,,,,< 0.5,Sidesplit,"Full, Partially Finished","Brick, Vinyl Siding",Central Air,Private Drive Double Wide,Landscaped,"Forced Air, Natural Gas","Auto Garage Door Remote(s), Wet Bar","Laundry Room, Lower Level","Urban, Rectangular, Cul-De-Sac, Hospital, Library, Playground Nearby, Schools, Shopping Nearby",Shed(s),"Attached Garage, Garage Door Opener, Asphalt",,Asphalt Shing,Smoke Detector(s),"Cable Available, Garbage/Sanitary Collection, Natural Gas Connected, Recycling Pickup",,Municipal-Metered,Chlorination,,,,,,,,,Wood Burning,,"Other level
                
            
        
        
            
                :Lower3.43 X 2.82",,,Full,,,,,,,,,,,,,,,None,,None,,,,,,,,,,"Other level
                
            
        
        
            
                :Lower5.66 X 4.44",,,,,,,,,,,,,,,,,,,,,,,,,,,,,,,,,,,,,,,,,,,,,,,
https://www.royallepage.ca/en/property/ontario/london/57-464-commissioners-road-w/20223541/mls40461880/,"$629,999",,,3,3+0,,,,2008,,,1674.03 Square Feet,,,,R5-6,Sewer (Municipal),,,2nd Level2.51 X 2.08,Main Level2.64 X 3.96,Main Level3.53 X 4.55,Basement Level9.35 X 13.89,,Main Level4.39 X 3.38,2nd Level4.67 X 4.72,Main Level5.49 X 4.55,,,,,,Main Level1.19 X 4.19,,Main Level2.39 X 1.78,,,,,,Not Applicable,1.5 Storey,"Full, Unfinished",Brick,Central Air,Private Drive Double Wide,Landscaped,"Forced Air, Natural Gas","High Speed Internet, Ceiling Fan(s)",Main Level,"Urban, Dog Park, Greenbelt, Highway Access, Hospital, Landscaped, Major Anchor, Open Spaces, Park, Public Transit, Quiet Area, Shopping Nearby",,"Attached Garage, Garage Door Opener",,Shingle,Carbon Monoxide Detector(s),"Cable Connected, Electricity Connected, Natural Gas Connected",,Municipal-Metered,,,,,,,,,,,,,Main Level5.16 X 5.87,,,,,,,,,,,,,,,,Parking,,,,,,,,,,,,,,,,,,,,,,,,,,,,,,,,,,,,,,,,,,,,,,,,,,,,,,,,,,,,
https://www.royallepage.ca/en/property/ontario/london/402-1-jacksway-crescent/20231066/mls40462403/,"$374,900",,,2,1+1,,,,1991,,,895 Square Feet,,,,R9-3; H14,Sewer (Municipal),,,Main Level,Main Level3.89 X 2.49,Main Level3.81 X 3.10,,Main Level3.71 X 2.31,Main Level2.67 X 2.57,,Main Level5.18 X 3.71,,,,,,,,,,,,,,Not Applicable,1 Storey/Apt,None,"Stone, Stucco",Other,"Outside/Surface/Open, Visitor Parking","Balcony, Controlled Entry, Landscaped, Lawn Sprinkler System","Electric, Fireplace-Gas",Separate Heating Controls,"Multiple Locations, Shared","Urban, Ample Parking, Hospital, Open Spaces, Park, Place of Worship, Playground Nearby, Public Parking, Public Transit, Rec./Community Centre, Regional Mall, School Bus Route, Schools, Shopping Nearby, Trails",Gazebo,"Unassigned, Asphalt",Municipal Road,Asphalt Shing,,,Trees/Woods,Municipal,,River/Stream,,,,,$391,,,"Family Room, Gas",,,,,,,,,,,,,,,,,Main Level2.74 X 1.73,,"Elevator(s), Fitness Center, Parking",,,,,,,,,,,,,,,,,,,,,,,,,,,,,,,,,,,,,,,,,,,,,,,,,,,,,,,,,,,,
https://www.royallepage.ca/en/property/ontario/london/2661-tokala-tr/20219638/mlsx6704220/,"$949,999",Freehold,Single Family,3,3,,,,,,,,,,,,,Garage,6,Main Level1.64 m x 1.25 m5.38 ft x 4.10 ft,,2nd Level4.27 m x 3.68 m14.01 ft x 12.07 ft,,Main Level3.67 m x 3.07 m12.04 ft x 10.07 ft,Main Level3.97 m x 2.75 m13.02 ft x 9.02 ft,,Main Level7.31 m x 3.97 m23.98 ft x 13.02 ft,,,,"Sewer - Available, Hydro - Available, Cable - Available, Natural Gas - Available",,Main Level5.80 m x 1.55 m19.03 ft x 5.09 ft,,2nd Level2.46 m x 1.82 m8.07 ft x 5.97 ft,,,,,,,,,,,,,,,,,,,,,,,,,,,Yes,95.03 x 141.73 FT ; Ft X 12.41 Ft X 115.15,2nd Level3.69 m x 3.38 m12.11 ft x 11.09 ft,2nd Level3.99 m x 3.99 m13.09 ft x 13.09 ft,,,,,,,,,,,,,,,,,,,,,,,,,,,,,,,,,,,,,,,,,,,,,,,,,,,,,,,,,,,,,,,,,,,,,,,,,,,,,,,,,,,
https://www.royallepage.ca/en/property/ontario/london/63-cathcart-street/20221029/mls40461284/,"$849,900",,,5,,,,,19003,,,2470 Square Feet,,97.62 Feet,31.08 Feet,R2-2,Sewer (Municipal),,,,,,,,,,,,,,,,,,,,,,,,< 0.5,,"Full, Unfinished",Brick,Central Air,Private Drive Double Wide,"Controlled Entry, Private Entrance, Separate Hydro Meters","Forced Air, Natural Gas","Separate Heating Controls, Separate Hydro Meters",In-Suite,"Urban, Rectangular, Corner Lot, Dog Park, City Lot, Greenbelt, Library, Open Spaces, Park, Place of Worship, Playground Nearby, Public Transit, Quiet Area, Rec./Community Centre, School Bus Route, Schools, Shopping Nearby",,"Attached Garage, Exclusive",,Asphalt Shing,None,,,Municipal-Metered,,River/Stream,,,,,,,,Gas,,,,,,,,,,,,,,,,,,,,,,,,,,,,,,,,,,,,,,,,,,,,,,,,,,,,,,,,,,,,,,,,,,,,,,,,,,,,,,,
https://www.royallepage.ca/en/property/ontario/london/1202-smither-rd/20218044/mlsx6703352/,"$819,900",Freehold,Single Family,3+1,4,,,"Hospital, Park, Public Transit, Schools",,,,,,,,,,Attached garage,4,Lower LevelMeasurements not available,,2nd Level4.18 m x 4.27 m13.71 ft x 14.01 ft,Lower Level6.40 m x 3.35 m21.00 ft x 10.99 ft,Main Level3.05 m x 3.05 m10.01 ft x 10.01 ft,Main Level3.05 m x 2.74 m10.01 ft x 8.99 ft,,Main Level5.49 m x 3.66 m18.01 ft x 12.01 ft,,,,,,,,,,,,,,,,,,,,,,,,,,,,,,,,,,,Yes,52 x 105.31 FT,2nd Level3.05 m x 3.44 m10.01 ft x 11.29 ft,2nd Level3.51 m x 3.35 m11.52 ft x 10.99 ft,,,,,,,,,,,,,,,,,,,,,,,,,,,,,,,,,,,,,,,,,,,,,,,,,,,,,,,,,,,,,,,,,,,,,,,,,,,,,,,,,,,
https://www.royallepage.ca/en/property/ontario/london/18-2621-holbrook-dr/20218374/mlsx6703968/,"$649,000",Freehold,Single Family,3,3,,,,,,,,,,,,,Attached garage,2,,,2nd Level5.45 m x 3.43 m17.88 ft x 11.25 ft,,Main Level2.78 m x 3.46 m9.12 ft x 11.35 ft,Main Level3.10 m x 3.56 m10.17 ft x 11.68 ft,,Main Level5.45 m x 3.45 m17.88 ft x 11.32 ft,,,,,,,,2nd LevelMeasurements not available,,,,,,,,,,,,,,,,,,,,,,,,,,,Yes,18.41 x 86.91 FT,2nd Level3.56 m x 2.90 m11.68 ft x 9.51 ft,2nd Level3.56 m x 2.80 m11.68 ft x 9.19 ft,,,,,,,,,,,,,,,,,,,,,,,,,,,,,,,,,,,,,,,,,,,,,,,,,,,,,,,,,,,,,,,,,,,,,,,,,,,,,,,,,,,
https://www.royallepage.ca/en/property/ontario/london/1366-bush-hill-link/20221031/mls40461493/,"$974,900",,,4,3+1,,,,,,,2156 Square Feet,,114 Feet,36.00 Feet,R1-3,Sewer (Municipal),,,Main Level,2nd Level3.20 X 3.05,2nd Level4.88 X 3.96,,,Main Level3.35 X 3.71,,,,,,,,,,2nd Level1.52 X 1.78,,Main Level1.78 X 2.41,Main Level2.18 X 1.75,Main Level4.62 X 5.79,,< 0.5,Two Story,"Development Potential, Full, Unfinished, Sump Pump","Brick, Stucco",Central Air,Private Drive Double Wide,,"Forced Air, Natural Gas",Rough-in Bath,"Laundry Room, Upper Level","Urban, Rectangular, Near Golf Course, Park, Playground Nearby, Public Transit, Schools, Shopping Nearby, Trails",None,"Attached Garage, Paver Block, Inside Entry",Municipal Road,Shingle,None,"Cable Available, Electricity Available, Garbage/Sanitary Collection, High Speed Internet Avail, Natural Gas Available, Recycling Pickup, Phone Available",,Municipal,None,,,,,,,,,,,,2nd Level,,,,,,,,,,,,,,,,,None,Main Level3.35 X 3.05,,,,,,,,,,,,,,,,,,,,,,,,,,,,,,,,,,,,,,,,,,,,,,,,,,,,,,,,,,
https://www.royallepage.ca/en/property/ontario/london/1362-bush-hill-link/20221027/mls40461496/,"$874,900",,,3,2+1,,,,,,,1823 Square Feet,,114 Feet,36.00 Feet,R1-3,Sewer (Municipal),,,Main Level,2nd Level3.28 X 3.66,2nd Level4.19 X 3.96,,,Main Level3.10 X 2.74,,,,,,,,,,2nd Level1.63 X 2.79,,,Main Level1.83 X 2.57,Main Level4.27 X 5.49,,< 0.5,Two Story,"Development Potential, Full, Unfinished, Sump Pump","Brick, Stucco, Vinyl Siding",Central Air,Private Drive Double Wide,,"Forced Air, Natural Gas",Rough-in Bath,"Laundry Room, Upper Level","Urban, Rectangular, Near Golf Course, Park, Playground Nearby, Public Transit, Schools, Shopping Nearby, Trails",None,"Attached Garage, Paver Block, Inside Entry",Municipal Road,Shingle,None,"Cable Available, Electricity Available, Garbage/Sanitary Collection, High Speed Internet Avail, Natural Gas Available, Recycling Pickup, Phone Available",,Municipal,None,,,,,,,,,,,,2nd Level,,,,,,,,,,,,,,,,,None,Main Level3.10 X 2.74,,,,,,,,,,,,,,,,,,,,,,,,,,,,,,,,,,,,,,,,,,,,,,,,,,,,,,,,,,
https://www.royallepage.ca/en/property/ontario/london/18-2621-holbrook-drive/20219964/mls40461460/,"$649,000",,,3,2+1,,,,,,,1510 Square Feet,,86.91 Feet,18.41 Feet,Resident,Sewer (Municipal),,,2nd Level,2nd Level3.56 X 2.64,2nd Level5.44 X 3.66,,Main Level3.35 X 2.44,Main Level3.61 X 3.05,,Main Level5.31 X 4.19,,,,,,,,2nd Level,,,,,,< 0.5,Two Story,"Full, Unfinished","Brick Front, Vinyl Siding",Central Air,Private Drive Single Wide,,Forced Air,,,"Urban, Major Highway, Park, Place of Worship, Public Transit",,Attached Garage,,Asphalt Shing,,,,Municipal,,,,,,,,,,,,,,,,,,,,,,,,,,,,,"BBQs Permitted, Parking",,,,,,,,,,,,,,,,,,,,,,,,,,,,,,,,,,,,,,,,,,,,,,,,,,,,,,,,,,,,
https://www.royallepage.ca/en/property/ontario/london/80-112-north-centre-road/20219980/mls40461458/,"$529,900",,,3,2+2,,,,2011,,,1482 Square Feet,,,0.00 Feet,R6-5,Sewer (Municipal),,,2nd Level,2nd Level3.23 X 4.09,2nd Level4.57 X 3.02,,Main Level3.15 X 2.64,Main Level3.15 X 3.05,Basement Level3.23 X 6.53,Main Level3.40 X 5.66,,,,,,,Basement Level3.12 X 5.18,Basement Level3.05 X 3.66,,,,,,,Two Story,"Full, Finished","Brick, Vinyl Siding",Central Air,Private Drive Single Wide,,"Forced Air, Natural Gas",,,"Urban, Library, Place of Worship, Playground Nearby, Public Parking, Public Transit, Schools, Shopping Nearby",,Attached Garage,,Asphalt Shing,,,,Municipal,,,,,,,,,,,,,,,,,,,,,,,,,,,,,"BBQs Permitted, Parking",,,,,,,,,,,,,,,,,,,,,,,,,,,,,,,,,,,,,,,,,,,,,,,,,,,,,,,,,,,,
https://www.royallepage.ca/en/property/ontario/london/36-474-southdale-rd-e/20211063/mlsx6701506/,"$518,900",Condominium/Strata,Single Family,3+3,3,,,,,,,,,,,,,,1,Main LevelMeasurements not available,Main Level4.55 m x 3.48 m14.93 ft x 11.42 ft,2nd Level4.88 m x 3.35 m16.01 ft x 10.99 ft,,,Main Level3.35 m x 3.05 m10.99 ft x 10.01 ft,,Main Level5.59 m x 35.05 m18.34 ft x 114.99 ft,,,,,,,,,,,,,,,,,,,,,,,,,,,,,,,,,,,,,2nd Level4.06 m x 2.74 m13.32 ft x 8.99 ft,2nd Level2.44 m x 2.74 m8.01 ft x 8.99 ft,$334 Monthly,,,,,,,,,,,,,,,,,,,,,,,,,,Basement Level3.96 m x 3.66 m12.99 ft x 12.01 ft,,,,,,,,,,,,Basement Level3.96 m x 3.66 m12.99 ft x 12.01 ft,,,,,,,,,,,,,,,,,,,,,,,,,,,,,,,,,,,,,,,,,,,,
https://www.royallepage.ca/en/property/ontario/london/116-pitcarnie-road/20209071/mls40459288/,"$1,399,900",,,4,2+1,,,,1989,,,3128 Square Feet,,98.66 Feet,129.42 Feet,R1-10,Sewer (Municipal),,8,2nd Level3.94 X 2.95,2nd Level6.50 X 4.17,2nd Level7.47 X 5.77,,Main Level4.19 X 4.01,Main Level5.92 X 3.99,Main Level5.92 X 4.44,Main Level5.11 X 3.89,,,,,,,,Main Level4.44 X 1.80,,,,,,< 0.5,Two Story,"Full, Unfinished",Brick,Central Air,Private Drive Double Wide,,"Forced Air, Natural Gas",Central Vacuum Roughed-in,Main Level,"Urban, Park, Rec./Community Centre, Schools",,"Attached Garage, Paver Block",Public Road,Asphalt Shing,,"Cell Service, Electricity Connected, Garbage/Sanitary Collection, Natural Gas Connected, Phone Connected, Underground Utilities",,Municipal,,River/Stream,,,,,,,,"Insert, Gas, Wood Burning",Main Level4.17 X 3.89,,Basement Level8.86 X 8.43Note:Basement,,,Skylight(s),,,,,,,,,,,Basement Level10.69 X 7.65,,,None,,,,,,,,,,,,,,,,,,,,,,,,,,,,,,,,,,,,,,,,,,,,,,,,,,,,,,,,,,,
https://www.royallepage.ca/en/property/ontario/london/60-hartson-road/20214724/mls40461177/,"$1,049,900",,,4,2+1,,,,1968,,,1320 Square Feet,,150.39 Feet,123.93 Feet,R1-9,Sewer (Municipal),,7,"Other level
                
            
        
        
            
                :Lower3.12 X 1.98","Other level
                
            
        
        
            
                :Lower4.34 X 2.64",Main Level5.13 X 3.68,"Other level
                
            
        
        
            
                :Lower8.46 X 6.91",Main Level5.38 X 3.00,Main Level3.94 X 4.70,,Main Level5.56 X 5.69,,,,,,Main Level1.83 X 1.83,,"Other level
                
            
        
        
            
                :Lower3.28 X 2.24",,,,,,< 0.5,Bungalow,"Full, Finished","Brick, Vinyl Siding","Central Air, Energy Efficient",Private Drive Single Wide,"Built-in Barbecue, Canopy, Landscape Lighting, Landscaped, Lawn Sprinkler System, Lighting, Privacy","Forced Air, Natural Gas","Air Exchanger, Auto Garage Door Remote(s), Built-In Appliances, Ceiling Fan(s), In-law Capability, Wet Bar","Gas Dryer Hookup, In Basement, Laundry Room, Sink","Urban, Pie Shaped Lot, Ample Parking, Dog Park, City Lot, Near Golf Course, Highway Access, Landscaped, Library, Park, Place of Worship, Playground Nearby, Public Transit, Quiet Area, School Bus Route, Schools, Shopping Nearby, Skiing, Trails",Shed(s),"Attached Garage, Garage Door Opener, Interlock",,Asphalt Shing,"Carbon Monoxide Detector, Smoke Detector, Carbon Monoxide Detector(s), Smoke Detector(s)",,"Garden, Park/Greenbelt, Pool, Trees/Woods",Municipal-Metered,,River/Stream,,,,,,,,"Electric, Insert, Living Room","Other level
                
            
        
        
            
                :Lower3.00 X 1.91",,Main Level3.07 X 2.11,,Full,Window Coverings,,,,,,,,,,,"Other level
                
            
        
        
            
                :Lower2.74 X 1.93",,,"In Ground, Salt Water, In Ground, Salt Water",,,,,,,,,,,,,,,,,,,,,,,,,,,,,,,,,,,,,,,,,,,,,,,,,,,,,,,,,,,
https://www.royallepage.ca/en/property/ontario/london/360-northbrae-dr-n/20200355/mlsx6697058/,"$900,000",Freehold,Single Family,4+1,4,,,"Park, Public Transit, Schools",,Community Centre,,,,,,,,Detached garage,6,,2nd Level5.20 m x 3.60 m17.06 ft x 11.81 ft,,,Main Level3.87 m x 4.69 m12.70 ft x 15.39 ft,Main Level4.63 m x 4.23 m15.19 ft x 13.88 ft,,Main Level5.58 m x 4.24 m18.31 ft x 13.91 ft,,,,"Cable - Available, Sewer - Available, Hydro - Available, Natural Gas - Installed",,,,Main Level1.49 m x 2.41 m4.89 ft x 7.91 ft,Basement Level4.15 m x 1.59 m13.62 ft x 5.22 ft,,,,,,,,,,,,,,,,,,,,,,,,,,Yes,49.62 x 199.42 FT,2nd Level2.78 m x 3.60 m9.12 ft x 11.81 ft,2nd Level3.70 m x 4.15 m12.14 ft x 13.62 ft,,,,,,,,,,,,,,,,,,,,,,,,,,,2nd Level3.75 m x 2.80 m12.30 ft x 9.19 ft,,,,,,,,,Basement Level2.47 m x 2.44 m8.10 ft x 8.01 ft,,,Basement Level3.11 m x 2.80 m10.20 ft x 9.19 ft,,,,,,,,,,,,,,,,,,,,,,,,,,,,,,,,,,,,,,,,,,,,
https://www.royallepage.ca/en/property/ontario/london/1859-marconi-blvd/20204133/mlsx6698350/,"$724,999",Freehold,Single Family,2+2,2,,,"Hospital, Park, Public Transit, Schools",,,,,,,,,,Attached garage,3,,,Main Level4.60 m x 3.30 m15.09 ft x 10.83 ft,Basement Level7.01 m x 3.96 m23.00 ft x 12.99 ft,Main Level2.90 m x 2.31 m9.51 ft x 7.58 ft,Main Level4.93 m x 3.15 m16.17 ft x 10.33 ft,,Main Level5.41 m x 3.50 m17.75 ft x 11.48 ft,,,,,,,,,,,,,,,,,,,,,,,,,,,,,,,,,,,Yes,31.15 x 131.34 FT,Main Level3.07 m x 2.69 m10.07 ft x 8.83 ft,Basement Level4.06 m x 3.10 m13.32 ft x 10.17 ft,,,,,,,,,,,,,,,,,,,,,,,,,,,Basement Level4.83 m x 2.77 m15.85 ft x 9.09 ft,,,,,,,,,,,,,,,,,,,,,,,,,,,,,,,,,,,,,,,,,,,,,,,,,,,,,,,,
https://www.royallepage.ca/en/property/ontario/london/6881-royal-magnolia-avenue/20210003/mls40460742/,"$699,999",,,3,2+1,,,,,,,1908 Square Feet,,,24.00 Feet,R2-1 (17) R4-6 (12),Sewer (Municipal),,,Main Level,2nd Level3.51 X 3.35,2nd Level3.71 X 5.03,,Main Level3.96 X 3.51,Main Level3.96 X 3.51,,Main Level4.57 X 3.51,,,,,,Main Level3.45 X 3.20,,2nd Level2.39 X 1.83,,,,,,< 0.5,Two Story,"Full, Unfinished, Sump Pump","Aluminum Siding, Brick, Stucco",Central Air,Private Drive Single Wide,,"Forced Air, Natural Gas",,Upper Level,"Urban, Rectangular, Major Highway, Schools, Shopping Nearby",,Attached Garage,,Asphalt Shing,"Carbon Monoxide Detector, Smoke Detector, Carbon Monoxide Detector(s), Smoke Detector(s)","Cable Available, Electricity Available, High Speed Internet Avail, Phone Available",,Municipal,,,,,,,,,,,,,2nd Level,,,,,,,,,,,,,,,,,,,,,,,,,,,,,,,,,,,,,,,2nd Level4.57 X 2.13,,,,,,,,,,,,,,,,,,,,,,,,,,,,,,,,,,,,,
https://www.royallepage.ca/en/property/ontario/london/146-fennell-crescent/20210081/mls40460704/,"$699,000",,,4,2+0,,,,1976,,,1112 Square Feet,,110 Feet,44.00 Feet,R1-4,Sewer (Municipal),,,"Other level
                
            
        
        
            
                :Lower","Other level
                
            
        
        
            
                :Lower3.66 X 2.74",,"Other level
                
            
        
        
            
                :Lower5.49 X 3.89",,3rd Level4.88 X 3.05,,Main Level5.49 X 3.66,,,,,,,,,,,,,,< 0.5,Backsplit,"Separate Entrance, Full, Finished",Concrete,Central Air,Private Drive Single Wide,"Lighting, Privacy, Seasonal Living","Forced Air, Natural Gas","Built-In Appliances, In-law Capability","In Basement, Inside","Urban, Rectangular, High Traffic Area, Library, Park, Playground Nearby, Public Parking, Public Transit, Schools, Shopping Nearby",Workshop,Detached Garage,,Asphalt Shing,"Carbon Monoxide Detector, Smoke Detector, Carbon Monoxide Detector(s), Smoke Detector(s)","At Lot Line-Gas, At Lot Line-Hydro, At Lot Line-Municipal Water","City, Clear",Municipal-Metered,None,,,,,,,,,Electric,,,3rd Level3.66 X 3.05,,,Window Coverings,,,,,,,,,,,,,,,,Accessible Public Transit Nearby,,,,,,,,,,,,,,,,,,,,,,,,,,,,,,,,,,,,,,,,,,,,,,,,,,,,,,,,,
https://www.royallepage.ca/en/property/ontario/london/18-adswood-place/20210425/mls40461138/,"$649,900",,,4,2+0,,,,1974,,,1000 Square Feet,,111 Feet,40.00 Feet,SFR,Sewer (Municipal),,,3rd Level0.00 X 0.00,2nd Level3.99 X 2.49,2nd Level3.99 X 3.84,,,,3rd Level7.09 X 3.17,Main Level5.51 X 3.99,,,,,,,,"Other level
                
            
        
        
            
                :Lower2.67 X 2.01",,,,,,< 0.5,Backsplit,"Full, Partially Finished","Brick, Vinyl Siding",Central Air,Private Drive Single Wide,Privacy,"Forced Air, Natural Gas",High Speed Internet,,"Urban, Rectangular, Cul-De-Sac, Highway Access, Landscaped, Playground Nearby, Public Transit, School Bus Route, Schools, Shopping Nearby",,Asphalt,Municipal Road,Asphalt Shing,,"Cable Connected, Cell Service, Electricity Connected, Garbage/Sanitary Collection, Natural Gas Connected, Recycling Pickup, Street Lights",,Municipal,,,,,,,,,,,,,Main Level5.51 X 3.99Note:Kitchen/Dining Room,"Other level
                
            
        
        
            
                :Lower5.64 X 3.05",Full,,,,,,,,,,,,,,,None,,,,,,,,,,,,,,,,,,,,,,,,,,,,,,,,,,,,,,,,,,,,,,,,,,,,,,,,,,,
https://www.royallepage.ca/en/property/ontario/london/31-thorncrest-crescent/20210519/mls40460629/,"$640,000",,,3,1+0,,,,,,,686 Square Feet,,161.46 Feet,60.00 Feet,R1-8,Sewer (Municipal),,,Main Level,Main Level2.31 X 3.35,,,,Main Level2.34 X 2.74,,,,,,,,,,,,,,,,< 0.5,Bungalow,"Separate Entrance, Full, Partially Finished","Brick, Vinyl Siding",Central Air,Private Drive Single Wide,,"Fireplace-Gas, Forced Air, Natural Gas","In-law Capability, In-Law Floorplan","Lower Level, Main Level, Multiple Locations","Urban, Hospital, Park, Place of Worship, Playground Nearby, Public Transit, Quiet Area, School Bus Route, Schools, Shopping Nearby",,,,Asphalt Shing,,,,Municipal-Metered,,,,,,,,,,,,,Basement Level6.10 X 8.53Note:Basement,,Full,,,,,,,,,,,,,,,,,,,,,,,,,,,,,,,,,,,,,,,,,,,,,,,,,,,,,,,,,,,,,,,,,,,,,,,,,,
https://www.royallepage.ca/en/property/ontario/london/41-325-lighthouse-rd/20207852/mlsx6700260/,"$570,000",Condominium/Strata,Single Family,3+1,2,,,,,,,,,,,,,"Attached garage, Visitor parking",2,,,2nd Level4.27 m x 3.70 m14.01 ft x 12.14 ft,,Main Level5.09 m x 3.70 m16.70 ft x 12.14 ft,Main Level5.09 m x 3.70 m16.70 ft x 12.14 ft,3rd Level3.11 m x 2.47 m10.20 ft x 8.10 ft,Main Level5.09 m x 4.20 m16.70 ft x 13.78 ft,,,,,,,,,,,,,,,,,,,,,,,,,,,,,,,,,,,,,2nd Level3.55 m x 2.78 m11.65 ft x 9.12 ft,3rd Level4.69 m x 4.39 m15.39 ft x 14.40 ft,$135 Monthly,,,,,,Basement Level3.75 m x 2.75 m12.30 ft x 9.02 ft,,,,,,,,,,,,,,,,,,,,,,,,,,,,,,,,,,,,,,,,,,,,,,,,,,,,,,,,,,,,,,,,,,,,,,,,,,,,
https://www.royallepage.ca/en/property/ontario/london/783-berkshire-lane/20209090/mls40460925/,"$499,900",,,3,2+1,,,,1977,,,1500 Square Feet,,,,SFR,Sewer (Municipal),,,2nd Level,2nd Level3.35 X 4.65,2nd Level3.53 X 4.93,,,,Main Level5.31 X 3.53,Main Level3.91 X 3.43,,,,,,Main Level1.73 X 1.65,,"Other level
                
            
        
        
            
                :Lower",,,,,,,Two Story,"Development Potential, Full, Unfinished",Brick,Central Air,Covered Parking,Lighting,Forced Air,"Separate Heating Controls, Separate Hydro Meters, Water Meter",In Basement,"Urban, Rectangular, Business Centre, Dog Park, Near Golf Course, Highway Access, Hospital, Landscaped, Library, Major Highway, Park, Place of Worship, Public Transit, Quiet Area, Regional Mall, Schools, Shopping Nearby, Skiing, Trails",,Exclusive,"Municipal Road, Public Road, Year Round Road",Asphalt Shing,"Smoke Detector, Carbon Monoxide Detector(s), Smoke Detector(s)","Cable Available, Cell Service, Electricity Connected, Garbage/Sanitary Collection, High Speed Internet Avail, Natural Gas Available, Recycling Pickup, Street Lights, Phone Available",City,Municipal-Metered,,,,,,,,,,,,,"Other level
                
            
        
        
            
                :LowerNote:Basement",,Full,Window Coverings,,,,,,,,,,Paved,,Main Level6.71 X 3.40,Parking,,,,,,,,,,,,,,,,,,,,,,,,,,,,,,,,,,,,,,,,,,,,,,,,,,,,,,,,,,,,
https://www.royallepage.ca/en/property/ontario/london/2601-363-colborne-street/20214743/mls40458858/,"$384,900",,,2,2+0,,,,1986,,,1065.95 Square Feet,,,0.00 Feet,DA2,Sewer (Municipal),,,Main Level2.11 X 2.16,Main Level3.12 X 3.61,Main Level3.23 X 4.93,,Main Level3.48 X 4.70,Main Level2.41 X 3.38,,Main Level2.82 X 6.27,,,,,,,,Main Level,,,,,,,1 Storey/Apt,,Concrete,Central Air,Visitor Parking,,Forced Air,Elevator,In-Suite,"Urban, Airport, City Lot, Park, Public Transit, Schools",,,,Flat,"Carbon Monoxide Detector, Smoke Detector",,,Municipal,,,,,,,$601,,,,,,,,,,,,,,,,,,,,,,"Barbecue, Elevator(s), Fitness Center, Game Room, Pool, Tennis Court(s), Parking",,,,,,,,,,,,,,,,,,,,,,,,,,,,,,,,,,,,,,,,,,,,,,,,,,,,,,,,,,,,
https://www.royallepage.ca/en/property/ontario/london/118-1447-huron-st/20204811/mlsx6699152/,"$349,000",Condominium/Strata,Single Family,2,1,,,,,,Balcony,,,,,,,,1,,,Flat/Apartment Level3.54 m x 3.17 m11.61 ft x 10.40 ft,,Flat/Apartment Level2.44 m x 2.89 m8.01 ft x 9.48 ft,Flat/Apartment Level2.31 m x 2.29 m7.58 ft x 7.51 ft,,Flat/Apartment Level7.46 m x 3.49 m24.48 ft x 11.45 ft,,,,,,,,,,,,,,,,,,,,,,,,,,,,,,,,,,,,,Flat/Apartment Level2.69 m x 3.68 m8.83 ft x 12.07 ft,,$411 Monthly,,,,,,Flat/Apartment Level3.52 m x 1.16 m11.55 ft x 3.81 ft,,,,,,,,,,,,,,,,,,,,,,,,,,,,,,,,,,,,,,,,,,,,,,,,,,,,,,,,,,,,,,,,,,,,,,,,,,,,
https://www.royallepage.ca/en/property/ontario/london/2369-torrey-pines-way/20205250/mls40460618/,"$1,588,000",,,6,3+1,,,,2018,,,3067 Square Feet,,106.7 Feet,58.23 Feet,R1-5,Sewer (Municipal),,,2nd Level,2nd Level3.96 X 3.38,2nd Level5.03 X 4.42,,Main Level3.35 X 4.37,Main Level6.71 X 4.27,,Main Level6.10 X 4.27,,,,,,,,Main Level4.42 X 2.62,,,,Basement Level5.49 X 4.57,,< 0.5,Two Story,"Walk-Out Access, Full, Finished","Brick, Stone, Stucco",Central Air,Private Drive Double Wide,"Landscaped, Year Round Living","Forced Air, Natural Gas",Auto Garage Door Remote(s),Main Level,"Urban, Near Golf Course, Landscaped, Library, Park, Quiet Area, Rec./Community Centre, Schools, Shopping Nearby",None,"Attached Garage, Garage Door Opener, Paver Block",Municipal Road,Asphalt Shing,"Smoke Detector, Smoke Detector(s)","Electricity Connected, Garbage/Sanitary Collection, Natural Gas Connected, Recycling Pickup, Street Lights",,Municipal-Metered,,,,,,,,,,Gas,,Main Level3.20 X 4.27,,,,,,,,,,,,,,,,,,None,Main Level3.35 X 3.35,,,,,,,,,,,,,,,,,,,,,,,,,,,,,,,,,,,,,,,,,,,,,,,,,,,,,,,,,,
